{
  "schema_name": "phase1_consolidated_thread_catalog",
  "schema_version": "1.0",
  "package_type": "thread_catalog_consolidation",
  "scope": {
    "project": "Trump Diary",
    "period_label": "Year 1",
    "start_week": 1,
    "end_week": 53,
    "window_count": 13,
    "window_ids": [
      "window_001",
      "window_002",
      "window_003",
      "window_004",
      "window_005",
      "window_006",
      "window_007",
      "window_008",
      "window_009",
      "window_010",
      "window_011",
      "window_012",
      "window_013"
    ]
  },
  "build": {
    "created_at": "2026-03-10T01:52:57Z",
    "created_by": "build_phase1_consolidated_catalog_v1",
    "model": "gpt-5.4",
    "run_id": "20260310T015257Z",
    "prompt_version": "Trump Diary — Phase 1 Consolidation Prompt v1",
    "git_commit": "b45d184a7cc4fe2d07d286f222a65ad8d9aba87d"
  },
  "source_windows": [
    {
      "window_id": "window_001",
      "start_week": 1,
      "end_week": 10,
      "candidate_file": "/Volumes/PRINTIFY24/Democracy Clock Automation/Trump Diary/03_Candidates/window_001_weeks_01_10_candidate_threads.json",
      "candidate_count": 10
    },
    {
      "window_id": "window_002",
      "start_week": 5,
      "end_week": 14,
      "candidate_file": "/Volumes/PRINTIFY24/Democracy Clock Automation/Trump Diary/03_Candidates/window_002_weeks_05_14_candidate_threads.json",
      "candidate_count": 9
    },
    {
      "window_id": "window_003",
      "start_week": 9,
      "end_week": 18,
      "candidate_file": "/Volumes/PRINTIFY24/Democracy Clock Automation/Trump Diary/03_Candidates/window_003_weeks_09_18_candidate_threads.json",
      "candidate_count": 10
    },
    {
      "window_id": "window_004",
      "start_week": 13,
      "end_week": 22,
      "candidate_file": "/Volumes/PRINTIFY24/Democracy Clock Automation/Trump Diary/03_Candidates/window_004_weeks_13_22_candidate_threads.json",
      "candidate_count": 15
    },
    {
      "window_id": "window_005",
      "start_week": 17,
      "end_week": 26,
      "candidate_file": "/Volumes/PRINTIFY24/Democracy Clock Automation/Trump Diary/03_Candidates/window_005_weeks_17_26_candidate_threads.json",
      "candidate_count": 10
    },
    {
      "window_id": "window_006",
      "start_week": 21,
      "end_week": 30,
      "candidate_file": "/Volumes/PRINTIFY24/Democracy Clock Automation/Trump Diary/03_Candidates/window_006_weeks_21_30_candidate_threads.json",
      "candidate_count": 10
    },
    {
      "window_id": "window_007",
      "start_week": 25,
      "end_week": 34,
      "candidate_file": "/Volumes/PRINTIFY24/Democracy Clock Automation/Trump Diary/03_Candidates/window_007_weeks_25_34_candidate_threads.json",
      "candidate_count": 10
    },
    {
      "window_id": "window_008",
      "start_week": 29,
      "end_week": 38,
      "candidate_file": "/Volumes/PRINTIFY24/Democracy Clock Automation/Trump Diary/03_Candidates/window_008_weeks_29_38_candidate_threads.json",
      "candidate_count": 11
    },
    {
      "window_id": "window_009",
      "start_week": 33,
      "end_week": 42,
      "candidate_file": "/Volumes/PRINTIFY24/Democracy Clock Automation/Trump Diary/03_Candidates/window_009_weeks_33_42_candidate_threads.json",
      "candidate_count": 12
    },
    {
      "window_id": "window_010",
      "start_week": 37,
      "end_week": 46,
      "candidate_file": "/Volumes/PRINTIFY24/Democracy Clock Automation/Trump Diary/03_Candidates/window_010_weeks_37_46_candidate_threads.json",
      "candidate_count": 11
    },
    {
      "window_id": "window_011",
      "start_week": 41,
      "end_week": 50,
      "candidate_file": "/Volumes/PRINTIFY24/Democracy Clock Automation/Trump Diary/03_Candidates/window_011_weeks_41_50_candidate_threads.json",
      "candidate_count": 10
    },
    {
      "window_id": "window_012",
      "start_week": 44,
      "end_week": 53,
      "candidate_file": "/Volumes/PRINTIFY24/Democracy Clock Automation/Trump Diary/03_Candidates/window_012_weeks_44_53_candidate_threads.json",
      "candidate_count": 10
    },
    {
      "window_id": "window_013",
      "start_week": 45,
      "end_week": 53,
      "candidate_file": "/Volumes/PRINTIFY24/Democracy Clock Automation/Trump Diary/03_Candidates/window_013_weeks_45_53_candidate_threads.json",
      "candidate_count": 7
    }
  ],
  "canonical_threads": [
    {
      "thread_id": "THR_ADMIN_STATE_CAPTURE",
      "canonical_name": "Administrative state capture through civil-service purge, agency hollowing, and loyalist control",
      "short_name": "Administrative state capture",
      "description": "A year-long pattern of subordinating the federal bureaucracy to presidential and loyalist control through mass firings, Schedule F/G-style politicization, watchdog weakening, outsourcing, mission rewrites, and the destruction of neutral administrative capacity.",
      "scope_level": "thread",
      "window_ids": [
        "window_001",
        "window_002",
        "window_003",
        "window_004",
        "window_005",
        "window_006",
        "window_007",
        "window_008",
        "window_009",
        "window_010",
        "window_011",
        "window_012"
      ],
      "supporting_weeks": [
        1,
        2,
        3,
        4,
        5,
        6,
        7,
        8,
        9,
        10,
        11,
        12,
        13,
        14,
        15,
        16,
        17,
        18,
        20,
        21,
        25,
        26,
        28,
        30,
        31,
        32,
        33,
        34,
        35,
        36,
        37,
        39,
        40,
        41,
        42,
        43,
        44,
        48,
        49,
        50,
        53
      ],
      "source_candidate_ids": [
        "cand_ADMIN_STATE_CAPTURE_AND_DOGE",
        "cand_ADMIN_STATE_CAPTURE",
        "cand_ADMINISTRATIVE_STATE_HOLLOWING_AND_CAPTURE",
        "cand_ADMINISTRATIVE_STATE_CAPTURE",
        "cand_CIVIL_SERVICE_CAPTURE_AND_ADMINISTRATIVE_HOLLOWING",
        "cand_ADMINISTRATIVE_STATE_CAPTURE_AND_LOYALIST_RULE",
        "cand_ADMINISTRATIVE_STATE_CAPTURE_AND_LOYALIST_PURGE",
        "cand_EXECUTIVE_STATE_CAPTURE",
        "cand_EXECUTIVE_STATE_CAPTURE_AND_CIVIL_SERVICE_PURGE",
        "cand_ADMINISTRATIVE_AND_REGULATORY_CAPTURE"
      ],
      "source_candidate_names": [
        "Administrative state capture through DOGE, civil-service purge, and executive centralization",
        "Administrative state capture through DOGE, mass layoffs, and politicized restructuring",
        "Administrative state hollowing, capture, and politicized restructuring",
        "Administrative state capture through civil-service purge, agency hollowing, and loyalist control",
        "Civil service capture and administrative hollowing",
        "Administrative state capture through loyalist appointments, purges, and hollowing-out",
        "Administrative state capture through purges, loyalist appointments, and dismantling of neutral expertise",
        "Executive capture of neutral institutions, civil service, and oversight bodies",
        "Executive capture of the state through civil-service purge, agency politicization, and oversight hollowing",
        "Administrative and regulatory institutions are captured, hollowed out, or bent to ideological ends"
      ],
      "aliases": [
        "civil-service purge",
        "agency hollowing",
        "bureaucratic capture",
        "loyalist staffing",
        "state capture via purges",
        "agency politicization",
        "hollowing out neutral institutions",
        "DOGE-driven restructuring"
      ],
      "inclusion_notes": [
        "Include DOGE- or White House-driven personnel purges, reclassification of career staff, watchdog weakening, outsourcing, and loyalist appointments.",
        "Include mission rewrites and service-capacity destruction when agencies are repurposed away from neutral public administration.",
        "Include captured regulatory, science, welfare, diplomatic, and security institutions when the core pattern is internal state control."
      ],
      "exclusion_notes": [
        "Exclude separation-of-powers conflict when the main issue is emergency rule, court defiance, or unilateral presidential authority rather than internal bureaucratic capture.",
        "Exclude crony enrichment stories unless agency capture or administrative machinery is the central mechanism.",
        "Exclude purely public-facing narrative control unless the main issue is bureaucratic staffing or institutional control."
      ],
      "boundary_notes": [
        "Distinct from THR_EXECUTIVE_OVERREACH_AND_EMERGENCY_RULE, which centers unilateralism and weakening of interbranch checks.",
        "Distinct from THR_CRONY_CAPITALISM_AND_PRIVATE_STATE_FUSION, which centers who profits from capture rather than the capture itself.",
        "Overlaps with THR_INFORMATION_CONTROL_AND_MEMORY_POLITICS when records, data, or expert bodies are manipulated as part of agency takeover."
      ],
      "parent_thread_id": null,
      "child_thread_ids": [],
      "related_thread_ids": [
        "THR_EXECUTIVE_OVERREACH_AND_EMERGENCY_RULE",
        "THR_CRONY_CAPITALISM_AND_PRIVATE_STATE_FUSION",
        "THR_INFORMATION_CONTROL_AND_MEMORY_POLITICS"
      ],
      "continuity_summary": "Persistent from the opening weeks through late year, first anchored in DOGE and civil-service purges, then extended into health, science, security, welfare, and regulatory institutions as a durable governing method.",
      "merge_rationale": "Across nearly all windows, labels about DOGE, civil-service purge, administrative hollowing, agency capture, loyalist appointments, and bureaucratic politicization describe the same underlying recurring project. A single operational thread is more useful downstream than preserving separate DOGE-era, science-agency, and late-year staffing labels as independent top-level threads.",